{"blazon":{"allow_provisional":true,"description":"Worked example from the Tincture specs. Unsigned; placeholder signer keys.","namespace":"badwolf.software/acme/prod","spec":"tincture/0.1","version":42},"defaults":{"audit":"full","handle_ttl":"5m","min_tier":"T2"},"pipelines":{"licence-unlock":{"errors":"opaque","id":"42d6c118d09b23dab42c7b495c7d3678","inputs":{"device-key":"envelope<or>","lic":"envelope<azure>"},"output":{"features":"$features"},"outputs":{"features":"data<argent>"},"reveal":true,"steps":[{"id":"k","in":"$input.device-key","use":"profile:device-unwrap"},{"id":"outer","in":"$input.lic","key":"$k","use":"profile:azure-open"},{"as":"argent","field":"/features","id":"features","in":"$outer","use":"extract"}],"version":3}},"profiles":{"audit-checkpoint-sign":{"id":"5c69620cbfd98a9268a9969b4fdb47be","in":"argent","op":"sign","out":"purpure","suite":"0x0320","version":1},"azure-open":{"id":"24ac8d8862e37dda9619145ce03bced6","in":"azure","op":"open","out":"licence-wire","version":1},"contact-ssn-read":{"callers":["crm-service"],"context":"required","id":"7ab18e79508352431a520c03c72463e6","in":"vert","op":"open","out":"argent","reveal":true,"version":1},"device-unwrap":{"id":"79bed03d69f7ee6159386474bdc35dfd","in":"or","op":"unwrap","out":"or","version":1},"intake-to-storage":{"context_out":"caller","id":"fbb4ff12f367260d263b5d8e1c9576f2","in":"azure","op":"transfer","out":"vert","version":2},"licence-open":{"callers":["licensing-service"],"context":"required","id":"e3c1f73b0413e69eaec94e4750b8a5b3","in":"licence","limits":{"max_calls_per_minute":60},"op":"open","out":"licence","version":3}},"quantum":{"deadline":"2030-01-01","enforce":"warn","migration":"2y"},"rules":{"max_layer_depth":3,"no_self_layering":true,"reveal_allow":["vert","licence-wire"],"transfer_graph":[["azure","vert"],["licence-wire","licence"]]},"signers":{"keys":[{"id":"owner","public":"AAAAAAAAAAAAAAAAAAAAAAAAAAAAAAAAAAAAAAAAAAA","suite":"0x0301"},{"id":"security","public":"AAAAAAAAAAAAAAAAAAAAAAAAAAAAAAAAAAAAAAAAAAA","suite":"0x0301"},{"id":"offline","public":"AAAAAAAAAAAAAAAAAAAAAAAAAAAAAAAAAAAAAAAAAAA","suite":"0x0330"}],"threshold":2},"tinctures":{"argent":{"id":"c7d534d9fe55942d36e6b743d26e97fd","kind":"symmetric","role":"clear","suites":[]},"azure":{"attestation":["android-key","app-attest","tpm-quote"],"horizon":"10y","id":"7cfd28f0f4eaef1c7fb71839e17682c1","kind":"sealed-to","recipients":"directory:devices","suites":["0x0201","0x0210"]},"ermine":{"id":"ea20e3bc356baf6ad8887204f5d1cdb5","kind":"symmetric","role":"canary","suites":["0x0101"]},"licence":{"context":"required","horizon":"2y","id":"a198f0579ca5df3a69f893f5a37d742a","kind":"symmetric","min_tier":"T3","suites":["0x0101"]},"licence-wire":{"id":"3b6afda52d466a470fca26321caafb17","kind":"symmetric","min_tier":"T2","suites":["0x0101"]},"or":{"id":"16f8bc8e901921420663ba1c64e8bade","kind":"symmetric","min_tier":"T3","mode":"wrapped","role":"key-material","suites":["0x0101"]},"purpure":{"id":"2b82e9317cc4641a82da69e7ed23ca9f","kind":"symmetric","min_tier":"T3","suites":["0x0101"]},"vert":{"context":"required","horizon":"10y","id":"22eedb41c29f0fd34211bdef6dc24471","kind":"symmetric","max_plaintext":"64MiB","min_tier":"T2","mode":"auto","padding":"padme","rotation":{"max_age":"90d","max_seals":100000000,"propagation":"24h","retain":"400d","rewrap":"lazy+bulk"},"suites":["0x0101","0x0102"]}}}
